{
  "$schema": "https://json-schema.org/draft/2020-12/schema",
  "type": "object",
  "properties": {
    "equipmentId": {
      "type": "string",
      "minLength": 1
    },
    "from": {
      "type": "string",
      "pattern": "^\\d{4}-\\d{2}-\\d{2}T\\d{2}:\\d{2}:\\d{2}\\.\\d{3}$"
    },
    "to": {
      "type": "string",
      "pattern": "^\\d{4}-\\d{2}-\\d{2}T\\d{2}:\\d{2}:\\d{2}\\.\\d{3}$"
    },
    "aliases": {
      "type": "array",
      "items": {
        "type": "object",
        "properties": {
          "alias": {
            "type": "string",
            "minLength": 1
          },
          "references": {
            "type": "integer",
            "minimum": 0,
            "maximum": 9007199254740991
          },
          "slots": {
            "type": "array",
            "items": {
              "type": "string",
              "minLength": 1
            },
            "description": "Distinct slots: signed decimal integers first by exact BigInt value, ties by code unit; then other strings by code unit."
          },
          "activity": {
            "type": "array",
            "items": {
              "type": "object",
              "properties": {
                "kind": {
                  "type": "string",
                  "enum": [
                    "VISIT",
                    "TRANSFER",
                    "PROCESS",
                    "POST_PROCESS",
                    "FUNCTION",
                    "CARRIER_PRESENCE"
                  ]
                },
                "count": {
                  "type": "integer",
                  "minimum": 0,
                  "maximum": 9007199254740991
                }
              },
              "required": [
                "kind",
                "count"
              ],
              "additionalProperties": false
            }
          },
          "firstSeen": {
            "anyOf": [
              {
                "type": "string",
                "pattern": "^\\d{4}-\\d{2}-\\d{2}T\\d{2}:\\d{2}:\\d{2}\\.\\d{3}$"
              },
              {
                "type": "null"
              }
            ]
          },
          "lastSeen": {
            "anyOf": [
              {
                "type": "string",
                "pattern": "^\\d{4}-\\d{2}-\\d{2}T\\d{2}:\\d{2}:\\d{2}\\.\\d{3}$"
              },
              {
                "type": "null"
              }
            ]
          },
          "moduleType": {
            "type": "string"
          },
          "isPort": {
            "type": "boolean"
          },
          "isRobot": {
            "type": "boolean"
          }
        },
        "required": [
          "alias",
          "references",
          "slots",
          "activity",
          "firstSeen",
          "lastSeen"
        ],
        "additionalProperties": false
      },
      "description": "Sorted by alias in code-unit order; one reference per Occurrence per alias."
    },
    "transfers": {
      "type": "array",
      "items": {
        "type": "object",
        "properties": {
          "from": {
            "type": "string",
            "minLength": 1
          },
          "to": {
            "type": "string",
            "minLength": 1
          },
          "count": {
            "type": "integer",
            "minimum": 0,
            "maximum": 9007199254740991
          }
        },
        "required": [
          "from",
          "to",
          "count"
        ],
        "additionalProperties": false
      },
      "description": "TRANSFER pairs with both endpoints present, sorted by (from, to) in code-unit order."
    }
  },
  "required": [
    "equipmentId",
    "from",
    "to",
    "aliases",
    "transfers"
  ],
  "additionalProperties": false
}
