{
  "equipmentId": "eq-demo-01",
  "from": "2026-01-02T08:00:00.000",
  "to": "2026-01-02T12:00:00.000",
  "aliases": [
    {
      "alias": "ALN1",
      "references": 150,
      "slots": [
        "1"
      ],
      "activity": [
        {
          "kind": "VISIT",
          "count": 50
        }
      ],
      "firstSeen": "2026-01-02T08:01:30.000",
      "lastSeen": "2026-01-02T11:26:50.696",
      "moduleType": "DEMO_ALIGNER",
      "isPort": false,
      "isRobot": false
    },
    {
      "alias": "EFEM_R1",
      "references": 150,
      "slots": [
        "1",
        "2"
      ],
      "activity": [
        {
          "kind": "TRANSFER",
          "count": 150
        }
      ],
      "firstSeen": "2026-01-02T08:01:30.000",
      "lastSeen": "2026-01-02T11:40:30.947",
      "moduleType": "DEMO_ATM_ROBOT",
      "isPort": false,
      "isRobot": true
    },
    {
      "alias": "LL1",
      "references": 150,
      "slots": [
        "1",
        "2"
      ],
      "activity": [
        {
          "kind": "VISIT",
          "count": 50
        }
      ],
      "firstSeen": "2026-01-02T08:02:01.463",
      "lastSeen": "2026-01-02T11:34:41.076",
      "moduleType": "DEMO_LOADLOCK",
      "isPort": false,
      "isRobot": false
    },
    {
      "alias": "LL2",
      "references": 150,
      "slots": [
        "1",
        "2"
      ],
      "activity": [
        {
          "kind": "VISIT",
          "count": 50
        }
      ],
      "firstSeen": "2026-01-02T08:15:21.191",
      "lastSeen": "2026-01-02T11:40:30.947",
      "moduleType": "DEMO_LOADLOCK",
      "isPort": false,
      "isRobot": false
    },
    {
      "alias": "LP1",
      "references": 101,
      "slots": [
        "0",
        "1",
        "2",
        "3",
        "4",
        "5",
        "6",
        "7",
        "8",
        "9",
        "10",
        "11",
        "12",
        "13",
        "14",
        "15",
        "16",
        "17",
        "18",
        "19",
        "20",
        "21",
        "22",
        "23",
        "24",
        "25"
      ],
      "activity": [
        {
          "kind": "CARRIER_PRESENCE",
          "count": 1
        },
        {
          "kind": "VISIT",
          "count": 50
        }
      ],
      "firstSeen": "2026-01-02T08:00:00.000",
      "lastSeen": "2026-01-02T09:39:16.856",
      "moduleType": "DEMO_LOADPORT",
      "isPort": true,
      "isRobot": false
    },
    {
      "alias": "LP2",
      "references": 101,
      "slots": [
        "0",
        "1",
        "2",
        "3",
        "4",
        "5",
        "6",
        "7",
        "8",
        "9",
        "10",
        "11",
        "12",
        "13",
        "14",
        "15",
        "16",
        "17",
        "18",
        "19",
        "20",
        "21",
        "22",
        "23",
        "24",
        "25"
      ],
      "activity": [
        {
          "kind": "CARRIER_PRESENCE",
          "count": 1
        },
        {
          "kind": "VISIT",
          "count": 50
        }
      ],
      "firstSeen": "2026-01-02T10:00:00.000",
      "lastSeen": "2026-01-02T11:40:30.947",
      "moduleType": "DEMO_LOADPORT",
      "isPort": true,
      "isRobot": false
    },
    {
      "alias": "PM1",
      "references": 39,
      "slots": [
        "1"
      ],
      "activity": [
        {
          "kind": "PROCESS",
          "count": 13
        }
      ],
      "firstSeen": "2026-01-02T08:03:12.781",
      "lastSeen": "2026-01-02T11:39:38.937",
      "moduleType": "DEMO_PROC_CH",
      "isPort": false,
      "isRobot": false
    },
    {
      "alias": "PM2",
      "references": 36,
      "slots": [
        "1"
      ],
      "activity": [
        {
          "kind": "PROCESS",
          "count": 12
        }
      ],
      "firstSeen": "2026-01-02T08:06:43.526",
      "lastSeen": "2026-01-02T11:27:36.731",
      "moduleType": "DEMO_PROC_CH",
      "isPort": false,
      "isRobot": false
    },
    {
      "alias": "PM3",
      "references": 36,
      "slots": [
        "1"
      ],
      "activity": [
        {
          "kind": "PROCESS",
          "count": 12
        }
      ],
      "firstSeen": "2026-01-02T08:10:14.153",
      "lastSeen": "2026-01-02T11:30:53.615",
      "moduleType": "DEMO_PROC_CH",
      "isPort": false,
      "isRobot": false
    },
    {
      "alias": "PM4",
      "references": 33,
      "slots": [
        "1"
      ],
      "activity": [
        {
          "kind": "PROCESS",
          "count": 11
        }
      ],
      "firstSeen": "2026-01-02T08:13:44.039",
      "lastSeen": "2026-01-02T11:33:48.179",
      "moduleType": "DEMO_PROC_CH",
      "isPort": false,
      "isRobot": false
    },
    {
      "alias": "PM5",
      "references": 6,
      "slots": [
        "1"
      ],
      "activity": [
        {
          "kind": "PROCESS",
          "count": 2
        }
      ],
      "firstSeen": "2026-01-02T08:45:23.780",
      "lastSeen": "2026-01-02T10:39:04.277",
      "moduleType": "DEMO_PROC_CH",
      "isPort": false,
      "isRobot": false
    },
    {
      "alias": "TM_R1",
      "references": 100,
      "slots": [
        "1"
      ],
      "activity": [
        {
          "kind": "TRANSFER",
          "count": 100
        }
      ],
      "firstSeen": "2026-01-02T08:03:12.781",
      "lastSeen": "2026-01-02T11:39:38.937",
      "moduleType": "DEMO_VAC_ROBOT",
      "isPort": false,
      "isRobot": true
    }
  ],
  "transfers": [
    {
      "from": "ALN1",
      "to": "LL1",
      "count": 26
    },
    {
      "from": "ALN1",
      "to": "LL2",
      "count": 24
    },
    {
      "from": "LL1",
      "to": "LP1",
      "count": 12
    },
    {
      "from": "LL1",
      "to": "LP2",
      "count": 12
    },
    {
      "from": "LL1",
      "to": "PM1",
      "count": 8
    },
    {
      "from": "LL1",
      "to": "PM2",
      "count": 6
    },
    {
      "from": "LL1",
      "to": "PM3",
      "count": 6
    },
    {
      "from": "LL1",
      "to": "PM4",
      "count": 6
    },
    {
      "from": "LL2",
      "to": "LP1",
      "count": 13
    },
    {
      "from": "LL2",
      "to": "LP2",
      "count": 13
    },
    {
      "from": "LL2",
      "to": "PM1",
      "count": 5
    },
    {
      "from": "LL2",
      "to": "PM2",
      "count": 6
    },
    {
      "from": "LL2",
      "to": "PM3",
      "count": 6
    },
    {
      "from": "LL2",
      "to": "PM4",
      "count": 5
    },
    {
      "from": "LL2",
      "to": "PM5",
      "count": 2
    },
    {
      "from": "LP1",
      "to": "ALN1",
      "count": 25
    },
    {
      "from": "LP2",
      "to": "ALN1",
      "count": 25
    },
    {
      "from": "PM1",
      "to": "LL1",
      "count": 5
    },
    {
      "from": "PM1",
      "to": "LL2",
      "count": 8
    },
    {
      "from": "PM2",
      "to": "LL1",
      "count": 6
    },
    {
      "from": "PM2",
      "to": "LL2",
      "count": 6
    },
    {
      "from": "PM3",
      "to": "LL1",
      "count": 6
    },
    {
      "from": "PM3",
      "to": "LL2",
      "count": 6
    },
    {
      "from": "PM4",
      "to": "LL1",
      "count": 5
    },
    {
      "from": "PM4",
      "to": "LL2",
      "count": 6
    },
    {
      "from": "PM5",
      "to": "LL1",
      "count": 2
    }
  ]
}
